[
  {"id":"AST-ROUTE-001","name":"Carretera curva","category":"route","capabilities":["route-path"],"file":"public/assets/original/route-curved.svg","status":"approved","availability":"bundled","source":"internal-original","license":{"kind":"internal-original","redistributable":true},"tags":["route-path"],"notes":""},
  {"id":"AST-ROUTE-002","name":"Carretera diagonal","category":"route","capabilities":["route-path"],"file":"public/assets/original/route-diagonal.svg","status":"approved","availability":"bundled","source":"internal-original","license":{"kind":"internal-original","redistributable":true},"tags":["route-path"],"notes":""},
  {"id":"AST-ROUTE-003","name":"Nodos de ruta","category":"route","capabilities":["location-node"],"file":"public/assets/original/route-nodes.svg","status":"approved","availability":"bundled","source":"internal-original","license":{"kind":"internal-original","redistributable":true},"tags":["location-node"],"notes":""},
  {"id":"AST-ROUTE-004","name":"Marcador de prioridad","category":"route","capabilities":["priority-marker"],"file":"public/assets/original/priority-marker.svg","status":"approved","availability":"bundled","source":"internal-original","license":{"kind":"internal-original","redistributable":true},"tags":["priority-marker"],"notes":""},
  {"id":"AST-VEH-001","name":"Van genérica de reparto","category":"vehicle","capabilities":["vehicle-generic"],"file":"public/assets/original/delivery-van.svg","status":"approved","availability":"bundled","source":"internal-original","license":{"kind":"internal-original","redistributable":true},"tags":["vehicle-generic"],"notes":""},
  {"id":"AST-VEH-002","name":"Pickup operativa genérica","category":"vehicle","capabilities":["vehicle-generic"],"file":"public/assets/original/utility-pickup.svg","status":"approved","availability":"bundled","source":"internal-original","license":{"kind":"internal-original","redistributable":true},"tags":["vehicle-generic"],"notes":""},
  {"id":"AST-WATER-001","name":"Gota lineal","category":"water","capabilities":["water-symbol"],"file":"public/assets/original/water-drop.svg","status":"approved","availability":"bundled","source":"internal-original","license":{"kind":"internal-original","redistributable":true},"tags":["water-symbol"],"notes":""},
  {"id":"AST-WATER-002","name":"Onda modular","category":"water","capabilities":["water-symbol","wave-ribbon"],"file":"public/assets/original/wave-ribbon.svg","status":"approved","availability":"bundled","source":"internal-original","license":{"kind":"internal-original","redistributable":true},"tags":["water-symbol","wave-ribbon"],"notes":""},
  {"id":"AST-WATER-003","name":"Flujo de agua","category":"water","capabilities":["water-symbol","process-line"],"file":"public/assets/original/water-flow.svg","status":"approved","availability":"bundled","source":"internal-original","license":{"kind":"internal-original","redistributable":true},"tags":["water-symbol","process-line"],"notes":""},
  {"id":"AST-MAP-001","name":"Retícula territorial","category":"map","capabilities":["map-grid"],"file":"public/assets/original/map-grid.svg","status":"approved","availability":"bundled","source":"internal-original","license":{"kind":"internal-original","redistributable":true},"tags":["map-grid"],"notes":""},
  {"id":"AST-MAP-002","name":"Pin territorial","category":"map","capabilities":["location-node"],"file":"public/assets/original/map-pin.svg","status":"approved","availability":"bundled","source":"internal-original","license":{"kind":"internal-original","redistributable":true},"tags":["location-node"],"notes":""},
  {"id":"AST-HOME-001","name":"Conjunto de viviendas","category":"scene","capabilities":["house-cluster"],"file":"public/assets/original/house-cluster.svg","status":"approved","availability":"bundled","source":"internal-original","license":{"kind":"internal-original","redistributable":true},"tags":["house-cluster"],"notes":""},
  {"id":"AST-PIPE-001","name":"Sección de tubería","category":"infrastructure","capabilities":["pipeline-section"],"file":"public/assets/original/pipeline-section.svg","status":"approved","availability":"bundled","source":"internal-original","license":{"kind":"internal-original","redistributable":true},"tags":["pipeline-section"],"notes":""},
  {"id":"AST-DATA-001","name":"Anillo de dato","category":"data","capabilities":["data-ring"],"file":"public/assets/original/data-ring.svg","status":"approved","availability":"bundled","source":"internal-original","license":{"kind":"internal-original","redistributable":true},"tags":["data-ring"],"notes":""},
  {"id":"AST-DATA-002","name":"Barras métricas","category":"data","capabilities":["metric-bars"],"file":"public/assets/original/metric-bars.svg","status":"approved","availability":"bundled","source":"internal-original","license":{"kind":"internal-original","redistributable":true},"tags":["metric-bars"],"notes":""},
  {"id":"AST-DATA-003","name":"Flecha comparativa","category":"data","capabilities":["comparison-arrow"],"file":"public/assets/original/comparison-arrow.svg","status":"approved","availability":"bundled","source":"internal-original","license":{"kind":"internal-original","redistributable":true},"tags":["comparison-arrow"],"notes":""},
  {"id":"AST-COMP-001","name":"Lower third neutro","category":"component","capabilities":["lower-third"],"file":"public/assets/original/lower-third.svg","status":"approved","availability":"bundled","source":"internal-original","license":{"kind":"internal-original","redistributable":true},"tags":["lower-third"],"notes":""},
  {"id":"AST-COMP-002","name":"Cintillo CTA neutro","category":"component","capabilities":["cta-strip"],"file":"public/assets/original/cta-strip.svg","status":"approved","availability":"bundled","source":"internal-original","license":{"kind":"internal-original","redistributable":true},"tags":["cta-strip"],"notes":""},
  {"id":"AST-COMP-003","name":"Footer institucional neutro","category":"component","capabilities":["institutional-footer"],"file":"public/assets/original/institutional-footer.svg","status":"approved","availability":"bundled","source":"internal-original","license":{"kind":"internal-original","redistributable":true},"tags":["institutional-footer"],"notes":""},
  {"id":"AST-COMP-004","name":"Marco de lanzamiento","category":"component","capabilities":["launch-frame"],"file":"public/assets/original/launch-frame.svg","status":"approved","availability":"bundled","source":"internal-original","license":{"kind":"internal-original","redistributable":true},"tags":["launch-frame"],"notes":""},
  {"id":"AST-COMP-005","name":"Marco de aviso","category":"component","capabilities":["notice-frame"],"file":"public/assets/original/notice-frame.svg","status":"approved","availability":"bundled","source":"internal-original","license":{"kind":"internal-original","redistributable":true},"tags":["notice-frame"],"notes":""},
  {"id":"AST-COMP-006","name":"Marco de cita","category":"component","capabilities":["quote-frame"],"file":"public/assets/original/quote-frame.svg","status":"approved","availability":"bundled","source":"internal-original","license":{"kind":"internal-original","redistributable":true},"tags":["quote-frame"],"notes":""},
  {"id":"AST-COMP-007","name":"Línea de proceso","category":"component","capabilities":["process-line"],"file":"public/assets/original/process-line.svg","status":"approved","availability":"bundled","source":"internal-original","license":{"kind":"internal-original","redistributable":true},"tags":["process-line"],"notes":""},
  {"id":"AST-PHOTO-001","name":"Máscara fotográfica diagonal","category":"photo","capabilities":["photo-mask"],"file":"public/assets/original/photo-mask.svg","status":"approved","availability":"bundled","source":"internal-original","license":{"kind":"internal-original","redistributable":true},"tags":["photo-mask"],"notes":""},
  {"id":"AST-TIME-001","name":"Nodos de cronología","category":"timeline","capabilities":["timeline-node"],"file":"public/assets/original/timeline-nodes.svg","status":"approved","availability":"bundled","source":"internal-original","license":{"kind":"internal-original","redistributable":true},"tags":["timeline-node"],"notes":""},
  {"id":"SLOT-BRAND-001","name":"Logo principal del Design System","category":"brand","capabilities":["brand-logo-slot"],"file":null,"status":"slot","availability":"external-required","source":"active-design-system-or-media-library","license":{"kind":"external-controlled","redistributable":false},"tags":["brand-logo-slot"],"notes":"Semantic slot only. Must be supplied by the active Design System or verified Media Library; never fabricate."},
  {"id":"SLOT-BRAND-002","name":"Logo aliado / co-branding","category":"brand","capabilities":["partner-logo-slot"],"file":null,"status":"slot","availability":"external-required","source":"active-design-system-or-media-library","license":{"kind":"external-controlled","redistributable":false},"tags":["partner-logo-slot"],"notes":"Semantic slot only. Must be supplied by the active Design System or verified Media Library; never fabricate."},
  {"id":"SLOT-BRAND-003","name":"Tipografía oficial","category":"brand","capabilities":["brand-font-slot"],"file":null,"status":"slot","availability":"external-required","source":"active-design-system-or-media-library","license":{"kind":"external-controlled","redistributable":false},"tags":["brand-font-slot"],"notes":"Semantic slot only. Must be supplied by the active Design System or verified Media Library; never fabricate."},
  {"id":"SLOT-MEDIA-001","name":"Fotografía real verificada","category":"media","capabilities":["real-photo-slot"],"file":null,"status":"slot","availability":"external-required","source":"active-design-system-or-media-library","license":{"kind":"external-controlled","redistributable":false},"tags":["real-photo-slot"],"notes":"Semantic slot only. Must be supplied by the active Design System or verified Media Library; never fabricate."},